{
  "schema_version": "1.0.0",
  "dataset_id": "im3_lifecycle_national_tranche_3_20260831",
  "artifact_type": "national_lifecycle_verification_tranche",
  "artifact_version": "2026.08.31",
  "generated_at": "2026-09-01T05:30:00Z",
  "data_vintage": "2026-08-31",
  "record_schema": "https://dccio.org/schemas/v1/public-national-lifecycle-verification-record.schema.json",
  "format": "json",
  "parts": [
    {
      "path": "data/silver/infrastructure/im3-2026.02.09-lifecycle-national-tranche-3.json",
      "sha256": "f31d1027c61a848ae097c172137417b98a5a7f9f3aa4c2b1551c6c1d82a282df",
      "byte_size": 51357,
      "record_count": 67,
      "partition_values": {
        "zone": "silver",
        "projection": "national_lifecycle_tranche"
      }
    },
    {
      "path": "data/silver/infrastructure/im3-2026.02.09-lifecycle-national-tranche-3.processing-report.json",
      "sha256": "96a8cc242111326c397ea25691f85e36c7bd696bd60171b252434673a46c9fd3",
      "byte_size": 1460,
      "record_count": 1,
      "partition_values": {
        "zone": "silver",
        "projection": "processing_report"
      }
    },
    {
      "path": "site/public/data/v1/lifecycle/national-tranche-3-results.json",
      "sha256": "45f18948819bae6059ba1c4d7fc81a81d0d4a25e098e014130b2368f69b73a2b",
      "byte_size": 8385,
      "record_count": 8,
      "partition_values": {
        "zone": "public",
        "projection": "national_lifecycle_results"
      }
    },
    {
      "path": "site/public/data/v1/lifecycle/national-tranche-3-remaining-queue.json",
      "sha256": "1ccce961774dc298829134554263e8cbd75ef37f6485baf6232466fb52e7d99d",
      "byte_size": 39017,
      "record_count": 24,
      "partition_values": {
        "zone": "public",
        "projection": "national_lifecycle_remaining_queue"
      }
    },
    {
      "path": "site/public/data/v1/counties/lifecycle-national-tranche-3-coverage.json",
      "sha256": "69e3057427c3c45454c0caadc139f8a771816920bea7388b05f8a097f166e263",
      "byte_size": 1138094,
      "record_count": 3144,
      "partition_values": {
        "zone": "public",
        "projection": "national_lifecycle_coverage"
      }
    },
    {
      "path": "site/public/data/v1/lifecycle/national-tranche-3-metadata.json",
      "sha256": "7c9c43939479d11868089121edad61dee711f46a006066f8ba1eadab3b325cbc",
      "byte_size": 1457,
      "record_count": 1,
      "partition_values": {
        "zone": "public",
        "projection": "national_lifecycle_metadata"
      }
    }
  ],
  "record_count": 3245,
  "input_dataset_ids": [
    "im3_lifecycle_national_tranche_2_20260831"
  ],
  "license_metadata": {
    "license": "Mixed source metadata; IM3-derived records remain ODbL",
    "redistribution_status": "mixed",
    "attribution": "© OpenStreetMap contributors; IM3 Open Source Data Center Atlas (PNNL/DOE)"
  }
}
