{
  "schema_version": "1.0.0",
  "dataset_id": "im3_lifecycle_national_tranche_6_20260831",
  "artifact_type": "national_lifecycle_verification_tranche",
  "artifact_version": "2026.08.31",
  "generated_at": "2026-09-01T18:00:00Z",
  "data_vintage": "2026-08-31",
  "record_schema": "https://dccio.org/schemas/v1/public-national-lifecycle-verification-record.schema.json",
  "format": "json",
  "parts": [
    {
      "path": "data/silver/infrastructure/im3-2026.02.09-lifecycle-national-tranche-6.json",
      "sha256": "4c188f70ec0798bbdf51f553c926b6c94e9b6ac29213338cecfef3eb9131b196",
      "byte_size": 52449,
      "record_count": 68,
      "partition_values": {
        "zone": "silver",
        "projection": "national_lifecycle_tranche"
      }
    },
    {
      "path": "data/silver/infrastructure/im3-2026.02.09-lifecycle-national-tranche-6.processing-report.json",
      "sha256": "c5ea0d00623aec7ad7a634bc8782e435386952198d11a491e7ee625dfca125f6",
      "byte_size": 1507,
      "record_count": 1,
      "partition_values": {
        "zone": "silver",
        "projection": "processing_report"
      }
    },
    {
      "path": "site/public/data/v1/lifecycle/national-tranche-6-results.json",
      "sha256": "21eb82933380b341f29df885ddf69320c0779c876a2041355c31033462d764ba",
      "byte_size": 8655,
      "record_count": 8,
      "partition_values": {
        "zone": "public",
        "projection": "national_lifecycle_results"
      }
    },
    {
      "path": "site/public/data/v1/lifecycle/national-tranche-6-remaining-queue.json",
      "sha256": "37517e5f3dc66819f61f5a7bb8ace1921282415f10551d2defa5c3eb0985b570",
      "byte_size": 3,
      "record_count": 0,
      "partition_values": {
        "zone": "public",
        "projection": "national_lifecycle_remaining_queue"
      }
    },
    {
      "path": "site/public/data/v1/counties/lifecycle-national-tranche-6-coverage.json",
      "sha256": "a8a2fcdba987bc12b07e7ada47d38322c08a27e783f022b534ea456257068ab5",
      "byte_size": 1138037,
      "record_count": 3144,
      "partition_values": {
        "zone": "public",
        "projection": "national_lifecycle_coverage"
      }
    },
    {
      "path": "site/public/data/v1/lifecycle/national-tranche-6-metadata.json",
      "sha256": "9e5326bae44a4af9a2b43b645df96417833de333bcc1a950b6c7f611145b70c6",
      "byte_size": 1504,
      "record_count": 1,
      "partition_values": {
        "zone": "public",
        "projection": "national_lifecycle_metadata"
      }
    }
  ],
  "record_count": 3222,
  "input_dataset_ids": [
    "im3_lifecycle_national_tranche_5_20260831"
  ],
  "license_metadata": {
    "license": "Mixed source metadata; IM3-derived records remain ODbL",
    "redistribution_status": "mixed",
    "attribution": "© OpenStreetMap contributors; IM3 Open Source Data Center Atlas (PNNL/DOE)"
  }
}
