{
  "schema_version": "1.0.0",
  "dataset_id": "im3_lifecycle_tranche_1_20260831",
  "artifact_type": "lifecycle_verification_tranche",
  "artifact_version": "2026.08.31",
  "generated_at": "2026-09-01T01:00:00Z",
  "data_vintage": "2026-08-31",
  "record_schema": "https://dccio.org/schemas/v1/public-lifecycle-verification-record.schema.json",
  "format": "json",
  "parts": [
    {
      "path": "data/silver/infrastructure/im3-2026.02.09-lifecycle-tranche-1.json",
      "sha256": "d071ad52fb60d7cc07c5c432382ae089e88d8e5ebf43a4801fdfdebd702bef6e",
      "byte_size": 40675,
      "record_count": 57,
      "partition_values": {
        "zone": "silver",
        "projection": "lifecycle_tranche"
      }
    },
    {
      "path": "data/silver/infrastructure/im3-2026.02.09-lifecycle-tranche-1.processing-report.json",
      "sha256": "05ed94b27b095d259bd5e6c7729a00f5d16adecc12c43fd5b0b3c087ab1bd647",
      "byte_size": 1128,
      "record_count": 1,
      "partition_values": {
        "zone": "silver",
        "projection": "processing_report"
      }
    },
    {
      "path": "site/public/data/v1/lifecycle/tranche-1-queue.json",
      "sha256": "b523662275a22c889a169f645d58baf7c3382c793ee4b82632cc851941c8ff83",
      "byte_size": 33194,
      "record_count": 24,
      "partition_values": {
        "zone": "public",
        "projection": "lifecycle_queue"
      }
    },
    {
      "path": "site/public/data/v1/lifecycle/tranche-1-results.json",
      "sha256": "d92119827543bbd5a88a36ca1ee61fbb38795d6cdb5311f3d7ae316f2b892dba",
      "byte_size": 6471,
      "record_count": 8,
      "partition_values": {
        "zone": "public",
        "projection": "lifecycle_results"
      }
    },
    {
      "path": "site/public/data/v1/counties/lifecycle-tranche-1-coverage.json",
      "sha256": "a0b15ba4b15506de6ded8a3e363169927e6f306774ec54ca3ce16bdb728614bc",
      "byte_size": 1136052,
      "record_count": 3144,
      "partition_values": {
        "zone": "public",
        "projection": "lifecycle_coverage"
      }
    },
    {
      "path": "site/public/data/v1/lifecycle/tranche-1-metadata.json",
      "sha256": "d0d532a7f4803c874e907b0ca9534cefed30fa676f226c630ac5788497cb7cd4",
      "byte_size": 1125,
      "record_count": 1,
      "partition_values": {
        "zone": "public",
        "projection": "lifecycle_metadata"
      }
    }
  ],
  "record_count": 3235,
  "input_dataset_ids": [
    "im3_lifecycle_verification_pilot_20260831"
  ],
  "license_metadata": {
    "license": "Mixed source metadata; IM3-derived records remain ODbL",
    "redistribution_status": "mixed",
    "attribution": "© OpenStreetMap contributors; IM3 Open Source Data Center Atlas (PNNL/DOE)"
  }
}
