{
  "schema_version": "1.0.0",
  "dataset_id": "im3_final_boundary_review_20260831",
  "artifact_type": "provisional_final_boundary_review",
  "artifact_version": "2026.08.31",
  "generated_at": "2026-09-01T00:05:59Z",
  "data_vintage": "2026-08-31",
  "record_schema": "https://dccio.org/schemas/v1/catalog.json",
  "format": "json",
  "parts": [
    {
      "path": "data/silver/infrastructure/im3-2026.02.09-final-boundary-review.json",
      "sha256": "b6762c24927609a26061d7581eb42abe8ddcec62721c768d890c4a68862d4725",
      "byte_size": 2148974,
      "record_count": 3069,
      "partition_values": {
        "zone": "silver",
        "projection": "final_boundary_review"
      }
    },
    {
      "path": "data/silver/infrastructure/im3-2026.02.09-final-boundary-review.processing-report.json",
      "sha256": "6a590a614266f1745119c59013c9640759866fc39332e2174432a2e5cf5942a5",
      "byte_size": 1200,
      "record_count": 1,
      "partition_values": {
        "zone": "silver",
        "projection": "processing_report"
      }
    },
    {
      "path": "site/public/data/v1/entity-resolution/final-index.json",
      "sha256": "79ba46785be1e0f8aefb642a36274bbe30afae2181a11a6eda9867b39172bc98",
      "byte_size": 337762,
      "record_count": 1472,
      "partition_values": {
        "zone": "public",
        "projection": "final_adjudication_index"
      }
    },
    {
      "path": "site/public/data/v1/counties/final-review-coverage.json",
      "sha256": "a54d51a22b91ea7715e5ebd29b6bf71128058ad0f62482322cecb0e55ecf378f",
      "byte_size": 1055615,
      "record_count": 3144,
      "partition_values": {
        "zone": "public",
        "projection": "final_review_coverage"
      }
    },
    {
      "path": "site/public/data/v1/entity-resolution/final-review-queue.json",
      "sha256": "37517e5f3dc66819f61f5a7bb8ace1921282415f10551d2defa5c3eb0985b570",
      "byte_size": 3,
      "record_count": 0,
      "partition_values": {
        "zone": "public",
        "projection": "final_review_queue"
      }
    },
    {
      "path": "site/public/data/v1/entity-resolution/final-review-decisions.json",
      "sha256": "52a2d770daf06d28e012f48a32e6c7784968f9c2aadcbb552f509449dd6edb3e",
      "byte_size": 2139,
      "record_count": 2,
      "partition_values": {
        "zone": "public",
        "projection": "final_review_decisions"
      }
    },
    {
      "path": "site/public/data/v1/entity-resolution/final-review-dossier.json",
      "sha256": "7bc5f9ebfcff20b2e58825505484e607920a6719151886ff78d7ea11f97032c1",
      "byte_size": 24812,
      "record_count": 16,
      "partition_values": {
        "zone": "public",
        "projection": "final_review_dossier"
      }
    },
    {
      "path": "site/public/data/v1/entity-resolution/final-review-metadata.json",
      "sha256": "bba48febb13838763be3a7274feb6bcf7ca9b5d7b9ad2564d771e94ff1e713e1",
      "byte_size": 1197,
      "record_count": 1,
      "partition_values": {
        "zone": "public",
        "projection": "final_review_metadata"
      }
    }
  ],
  "record_count": 7705,
  "input_dataset_ids": [
    "im3_entity_adjudication_20260831"
  ],
  "license_metadata": {
    "license": "Mixed source metadata; ODbL applies to IM3 and OSM-derived records",
    "redistribution_status": "metadata_only",
    "attribution": "© OpenStreetMap contributors; IM3 Open Source Data Center Atlas (PNNL/DOE)"
  }
}
