{
  "schema_version": "1.0.0",
  "dataset_id": "im3_lifecycle_national_tranche_2_20260831",
  "artifact_type": "national_lifecycle_verification_tranche",
  "artifact_version": "2026.08.31",
  "generated_at": "2026-09-02T01:00:00Z",
  "data_vintage": "2026-08-31",
  "record_schema": "https://dccio.org/schemas/v1/public-national-lifecycle-verification-record.schema.json",
  "format": "json",
  "parts": [
    {
      "path": "data/silver/infrastructure/im3-2026.02.09-lifecycle-national-tranche-2.json",
      "sha256": "1e8af0e5b64bb84b6037aec02b5981f2bd303f807db3064d58eb533853ace9cd",
      "byte_size": 47670,
      "record_count": 62,
      "partition_values": {
        "zone": "silver",
        "projection": "national_lifecycle_tranche"
      }
    },
    {
      "path": "data/silver/infrastructure/im3-2026.02.09-lifecycle-national-tranche-2.processing-report.json",
      "sha256": "39bb8b6b48350bf021d263791748fcb00ac88b917161095544af818afbfb7810",
      "byte_size": 1398,
      "record_count": 1,
      "partition_values": {
        "zone": "silver",
        "projection": "processing_report"
      }
    },
    {
      "path": "site/public/data/v1/lifecycle/national-tranche-2-results.json",
      "sha256": "e640f01cef8a0ab991f6a346525889013f4e402f8dd95ca85c5e913b333f6be2",
      "byte_size": 7945,
      "record_count": 8,
      "partition_values": {
        "zone": "public",
        "projection": "national_lifecycle_results"
      }
    },
    {
      "path": "site/public/data/v1/lifecycle/national-tranche-2-remaining-queue.json",
      "sha256": "dae6bb327c8c77fd36b73755dd9c49f9a507570b71e708d1aa88212e4b2c367a",
      "byte_size": 52324,
      "record_count": 32,
      "partition_values": {
        "zone": "public",
        "projection": "national_lifecycle_remaining_queue"
      }
    },
    {
      "path": "site/public/data/v1/counties/lifecycle-national-tranche-2-coverage.json",
      "sha256": "9030f35b2715fdc0a07df620e53a44523a25a0cedbc597bcc6f0f0efbee33dd4",
      "byte_size": 1138118,
      "record_count": 3144,
      "partition_values": {
        "zone": "public",
        "projection": "national_lifecycle_coverage"
      }
    },
    {
      "path": "site/public/data/v1/lifecycle/national-tranche-2-metadata.json",
      "sha256": "518e0497a4cc37a3b9c5492e3eef4e98dd2a7bd03edf69aec30b05e485b5ade5",
      "byte_size": 1395,
      "record_count": 1,
      "partition_values": {
        "zone": "public",
        "projection": "national_lifecycle_metadata"
      }
    }
  ],
  "record_count": 3248,
  "input_dataset_ids": [
    "im3_lifecycle_national_tranche_1_20260831"
  ],
  "license_metadata": {
    "license": "Mixed source metadata; IM3-derived records remain ODbL",
    "redistribution_status": "mixed",
    "attribution": "© OpenStreetMap contributors; IM3 Open Source Data Center Atlas (PNNL/DOE)"
  }
}
